{
  "schemaVersion": "1.0.0",
  "rankingVersion": 1,
  "generatedAt": "2026-10-19T17:42:54.052Z",
  "days": [
    {
      "date": "2026-10-19",
      "events": [
        {
          "id": "occ-b762d6425b95c93921c36bc8",
          "title": "IMPROV l Monday Night Improv w/ The Planet Ant Home Team",
          "summary": "Experience Detroit's longest-running improv show with the legendary Planet Ant Home Team, featuring fresh and hilarious comedy. Each night includes opening performances from The Planet Ant Farm Team and a guest troupe, promising an evening of spontaneous entertainment.",
          "url": "https://www.crowdwork.com/e/improv-l-monday-night-improv-w-the-planet-ant-home-team?date=2026-10-19T19%3A30%3A00.000-04%3A00",
          "start": "2026-10-19T19:30:00-04:00",
          "venue": "Black Box - 2357 Caniff Hamtramck, MI 48212 - Entrance in the rear",
          "city": "Hamtramck",
          "price": "$11.84",
          "category": "Comedy",
          "imageUrl": "https://cdn.fourthwalltickets.com/uploads/event/imgs/16212/A_J.png",
          "imageAlt": "IMPROV l Monday Night Improv w/ The Planet Ant Home Team",
          "status": "confirmed",
          "occurrenceId": "occ-b762d6425b95c93921c36bc8",
          "seriesId": "series-68ae390e9044f3465e74e97b",
          "sourceUpdatedAt": "2026-07-17T20:28:15.250000+00:00",
          "priceMin": 11.84,
          "priceMax": 11.84,
          "priceCurrency": "USD",
          "availability": "InStock",
          "lastCheckedAt": "2026-10-18T23:14:26.448605-04:00",
          "canonicalUrl": "https://www.crowdwork.com/e/improv-l-monday-night-improv-w-the-planet-ant-home-team?date=2026-10-19T19%3A30%3A00.000-04%3A00",
          "venueId": "black box 2357 caniff hamtramck mi 48212 entrance in the rear|hamtramck",
          "timePrecision": "time",
          "statusEvidence": "Organizer detail reviewed",
          "aliases": [
            "improv-l-monday-night-improv-w-the-plane-event-2026-10-19",
            "src-6dc0709df73d486280cd39bd"
          ],
          "legacyOccurrenceKeys": [
            "improv-l-monday-night-improv-w-the-plane-event-2026-10-19|2026-10-19T19:30:00-04:00",
            "src-6dc0709df73d486280cd39bd|2026-10-19T19:30:00-04:00"
          ],
          "legacySeriesKeys": [
            "series-0d2e2844d7838dcc1ec3405b",
            "series-56db6955308f473e2e93ea5a",
            "series-68ae390e9044f3465e74e97b",
            "series-85387e495c9816bf7784255d",
            "series-aadadfe4175d389eefccd9af",
            "series-abe8af9028ee2b3a9c37666f",
            "series-ac4926cf7ced09cc3df99c56",
            "series-d74cae94283d3b1db2161f0f",
            "series-f53a2cb35812fefbf2d5f51f"
          ],
          "sources": [
            {
              "sourceRecordId": "src-6dc0709df73d486280cd39bd",
              "sourceId": "planet-ant-theatre",
              "canonicalUrl": "https://www.crowdwork.com/e/improv-l-monday-night-improv-w-the-planet-ant-home-team?date=2026-10-19T19%3A30%3A00.000-04%3A00",
              "observedAt": "2026-10-12T15:41:41-04:00",
              "sourceUpdatedAt": "2026-07-17T20:28:15.250000+00:00",
              "sourceAuthority": "organizer",
              "status": "scheduled",
              "statusEvidence": "https://schema.org/EventScheduled"
            }
          ],
          "identity": {
            "ruleVersion": "occurrence-v1",
            "reasons": [
              "native-occurrence"
            ],
            "fields": {
              "title": "src-6dc0709df73d486280cd39bd",
              "start": "src-6dc0709df73d486280cd39bd",
              "venue": "src-6dc0709df73d486280cd39bd",
              "url": "src-6dc0709df73d486280cd39bd",
              "status": "src-6dc0709df73d486280cd39bd",
              "imageUrl": "src-6dc0709df73d486280cd39bd"
            },
            "conflicts": {}
          },
          "score": 87,
          "scoring": {
            "signals": {
              "funny": 0.99,
              "distinctive": 0.41,
              "eclectic": 0.15,
              "technical_science": 0.03,
              "artsy": 0.97,
              "progressive": 0.28,
              "outdoors": 0.02,
              "theatre": 0.33,
              "live_music": 0.03,
              "live_comedy": 0.99,
              "farmer_market": 0.01,
              "sporting": 0.01,
              "recurring": 0.99,
              "craft_fair_shopping": 0.01,
              "religious": 0.01,
              "large_venue": 0.02,
              "substance_recovery": 0.01,
              "popular_music_cover_band": 0.02,
              "market_or_shop": 0.01,
              "punk_metal_or_rock": 0.02,
              "dance": 0.03,
              "sales_related": 0.48,
              "children_activity": 0.02,
              "running": 0.01,
              "exercise": 0.01,
              "employment_related": 0.01
            },
            "score": 87,
            "rulesVersion": 2
          },
          "localityTier": "unknown",
          "experienceId": "experience:[\"hamtramck\",\"black box 2357 caniff hamtramck mi 48212 entrance in the rear\",\"improv l monday night improv w the planet ant home team\"]",
          "registration": "Online sales end 1 (one) hour before the start of a performance. If online sales are closed, there may still be tickets available for purchase at the box office.",
          "bookingUrl": "https://www.crowdwork.com/e/improv-l-monday-night-improv-w-the-planet-ant-home-team?date=2026-10-19T19%3A30%3A00.000-04%3A00",
          "editorial": {
            "state": "verified",
            "reviewedAt": "2026-10-18T23:14:26.448605-04:00",
            "expiresAt": "2026-10-19T23:14:26.448605-04:00",
            "sourceUrl": "https://www.crowdwork.com/e/improv-l-monday-night-improv-w-the-planet-ant-home-team?date=2026-10-19T19%3A30%3A00.000-04%3A00",
            "sourceHash": "caa5fe951a84f3969200005d29f86eb020edd4d22a57061906b3c97a23a1c05b",
            "inputFacts": {
              "id": "occ-b762d6425b95c93921c36bc8",
              "url": "https://www.crowdwork.com/e/improv-l-monday-night-improv-w-the-planet-ant-home-team?date=2026-10-19T19%3A30%3A00.000-04%3A00",
              "start": "2026-10-19T19:30:00-04:00",
              "end": null,
              "venue": "Black Box - 2357 Caniff Hamtramck, MI 48212 - Entrance in the rear",
              "city": "Hamtramck",
              "price": "$11.84",
              "status": "scheduled"
            },
            "evidence": {
              "date": "Oct 19",
              "time": "7:30 PM",
              "venue": "Black Box - 2357 Caniff Hamtramck, MI 48212 - Entrance in the rear",
              "admission": "{\"@type\": \"Offer\", \"url\": \"https://www.crowdwork.com/e/improv-l-monday-night-improv-w-the-planet-ant-home-team?date=2026-10-19T19:30:00\", \"price\": 11.84, \"priceCurrency\": \"USD\", \"availability\": \"https://schema.org/InStock\"}",
              "description": "Every Monday night, the Black Box stage brings the longest-running improv show in Detroit— a fresh, new, and hilarious night of comedy from the legendary Planet Ant Home Team.",
              "registration": "Online sales end 1 (one) hour before the start of a performance."
            }
          },
          "reviewExpiresAt": "2026-10-19T23:14:26.448605-04:00",
          "recommendation": {
            "occurrenceId": "occ-b762d6425b95c93921c36bc8",
            "score": 103,
            "components": {
              "taste": 87,
              "practicality": 12,
              "novelty": 0,
              "quality": 4
            },
            "reasons": [
              "funny +12",
              "live comedy +12",
              "Available on selected day +12",
              "Confirmed/recent source information +4"
            ],
            "unknowns": [
              "Distance unknown"
            ]
          }
        }
      ]
    },
    {
      "date": "2026-10-20",
      "events": [
        {
          "id": "occ-d865368f2cb4264bffacc35c",
          "title": "THEATRE l I'd Love to Have You for Dinner",
          "summary": "Experience a psychological thriller where a first date takes a dark turn. An ancient vampire and a vampire hunter meet for a home-cooked meal, leading to a two-act horror story exploring themes of cannibalism and predation. Viewer discretion is advised due to extreme violence and gore.",
          "url": "https://www.crowdwork.com/e/theatre-l-i-d-love-to-have-you-for-dinner?date=2026-10-24T20%3A00%3A00.000-04%3A00",
          "start": "2026-10-24T20:00:00-04:00",
          "venue": "Black Box - 2357 Caniff Hamtramck, MI 48212 - Entrance in the rear",
          "city": "Hamtramck",
          "price": "$27.6",
          "category": "Comedy",
          "imageUrl": "https://cdn.fourthwalltickets.com/uploads/event/imgs/18028/HORIZ.png",
          "imageAlt": "THEATRE l I'd Love to Have You for Dinner",
          "status": "confirmed",
          "occurrenceId": "occ-d865368f2cb4264bffacc35c",
          "seriesId": "series-4168b3b9cddf5675fb83e57e",
          "sourceUpdatedAt": "2026-10-05T22:12:01.154000+00:00",
          "priceMin": 27.6,
          "priceMax": 27.6,
          "priceCurrency": "USD",
          "availability": "InStock",
          "lastCheckedAt": "2026-10-18T18:09:31.480996-04:00",
          "canonicalUrl": "https://www.crowdwork.com/e/theatre-l-i-d-love-to-have-you-for-dinner?date=2026-10-24T20%3A00%3A00.000-04%3A00",
          "venueId": "black box 2357 caniff hamtramck mi 48212 entrance in the rear|hamtramck",
          "timePrecision": "time",
          "statusEvidence": "Organizer detail reviewed",
          "aliases": [
            "src-25b8fa3a367c4d4a74365acc",
            "src-dbe01611878823a1b4bf238a",
            "theatre-l-i-d-love-to-have-you-for-dinne-event-2026-10-24"
          ],
          "legacyOccurrenceKeys": [
            "src-25b8fa3a367c4d4a74365acc|2026-10-24T20:00:00-04:00",